{
  "$schema": "http://json-schema.org/draft-07/schema#",
  "type": ["object", "null"],
  "title": "Storage Schema",
  "description": "Schema for Storage components",
  "required": ["metadata"],
  "properties": {
    "opendb_id": {
      "type": ["string", "null"],
      "description": "Unique identifier for the document (UUID v4)"
    },
    "weight": {
      "description": "Product weight in grams for one complete, usable unit of this exact variant. Exclude retail packaging, shipping materials, multipack totals, and load capacity. Leave unset when the product is digital, the weight is unknown, or the source does not clearly identify product weight.",
      "type": ["number", "null"],
      "exclusiveMinimum": 0
    },
    "capacity": {
      "description": "The storage capacity of the drive in GB (e.g., 4000 GB)",
      "type": ["number", "null"]
    },
    "storage_type": {
      "description": "The type of storage drive (either HDD or SSD)",
      "type": ["string", "null"],
      "enum": ["SSD", "HDD", "SSHD", null]
    },
    "form_factor": {
      "description": "The physical size and shape of the drive (e.g., M.2-2280, 2.5\", 3.5\")",
      "type": ["string", "null"],
      "enum": [
        "M.2-2280",
        "M.2-22110",
        "M.2-2260",
        "M.2-2242",
        "M.2-2230",
        "2.5\"",
        "3.5\"",
        "mSATA",
        "PCIe",
        null
      ]
    },
    "interface": {
      "description": "The interface used by the drive (e.g., M.2 PCIe 4.0 X4, SATA 6Gb/s)",
      "type": ["string", "null"],
      "enum": [
        "M.2 PCIe 5.0 x4",
        "M.2 PCIe 5.0 x2",
        "M.2 PCIe 4.0 x4",
        "M.2 PCIe 4.0 x8",
        "M.2 PCIe 3.0 x16",
        "M.2 PCIe 3.0 x8",
        "M.2 PCIe 3.0 x4",
        "M.2 PCIe 3.0 x2",
        "M.2 PCIe 2.0 x4",
        "M.2 PCIe x4",
        "M.2 PCIe x2",
        "M.2 PCIe x1",
        "M.2 SATA",
        "SATA 6.0 Gb/s",
        "SATA 3.0 Gb/s",
        "SATA 1.5 Gb/s",
        "SAS 12.0 Gb/s",
        "SAS 6.0 Gb/s",
        "SAS 3.0 Gb/s",
        "U.2",
        "mSATA",
        "PATA 100",
        "PCIe x16",
        "PCIe x8",
        "PCIe x4",
        "PCIe x2",
        "PCIe x1",
        null
      ]
    },
    "cache": {
      "description": "The cache size of the drive in MB.",
      "type": ["number", "null"]
    },
    "nvme": {
      "description": "Whether the drive uses the NVMe protocol. Only applicable to SSDs",
      "type": ["boolean", "null"]
    },
    "lighting": {
      "description": "Lighting capabilities for this product. Use RGB for non-addressable RGB, ARGB for addressable RGB, Multicolor for non-RGB multi-color lighting, Fixed for a single fixed lighting color, None when the product has no lighting, Display for configurable displays, and Fixed Color Display for displays limited to fixed colors such as black and white.",
      "type": ["array", "null"],
      "items": {
        "type": "string",
        "enum": ["RGB", "ARGB", "Multicolor", "Fixed", "None", "Display", "Fixed Color Display"]
      }
    },
    "general_product_information": {
      "type": ["object", "null"],
      "description": "General product information and retailer SKUs",
      "properties": {
        "amazon_sku": {
          "type": ["string", "null"],
          "description": "Amazon product SKU"
        },
        "newegg_sku": {
          "type": ["string", "null"],
          "description": "Newegg product SKU"
        },
        "bestbuy_sku": {
          "type": ["number", "null"],
          "description": "Best Buy product SKU"
        },
        "walmart_sku": {
          "type": ["number", "null"],
          "description": "Walmart product SKU"
        },
        "adorama_sku": {
          "type": ["string", "null"],
          "description": "Adorama product SKU"
        },
        "ibuypower_sku": {
          "type": ["string", "null"],
          "description": "iBuyPower product SKU"
        },
        "hyte_sku": {
          "type": ["string", "null"],
          "description": "HYTE product SKU"
        },
        "lttstore_sku": {
          "type": ["string", "null"],
          "description": "LTTStore product SKU"
        },
        "manufacturer_url": {
          "type": ["string", "null"],
          "description": "Official manufacturer product URL"
        }
      }
    },
    "metadata": {
      "type": ["object", "null"],
      "properties": {
        "name": {
          "description": "Full product name",
          "type": ["string", "null"]
        },
        "manufacturer": {
          "description": "Storage manufacturer",
          "type": ["string", "null"]
        },
        "part_numbers": {
          "description": "Array of manufacturer's part numbers/SKUs",
          "type": ["array", "null"],
          "items": {
            "type": "string"
          }
        },
        "series": {
          "description": "Product series name The manufacturer's marketed product line / family for the drive. Manufacturer, `capacity`, `form_factor`, `interface`, `storage_type` (SSD vs HDD), and `nvme` are all stored separately and MUST NOT be repeated in the series. Capacity is NEVER part of the series. Examples: 'Samsung 990 Pro 2TB M.2-2280' → series='990 Pro'. 'WD_BLACK SN850X 2TB' → series='WD_BLACK SN850X' (the color tier is part of WD's marketed family name and IS part of the series for WD). 'Crucial MX500 1TB 2.5\" SATA' → series='MX500'. The series stays consistent across capacity tiers of the same product line.",
          "type": ["string", "null"]
        },
        "variant": {
          "description": "Specific variant in the series Most drives should have an empty variant — capacity, form factor, interface, NVMe, and storage type are all stored in their own fields. The most common non-empty case is a heatsink-bundled SKU vs the bare-drive SKU of the same series + capacity. Examples: 'Samsung 990 Pro 2TB' (bare) → variant=''. 'Samsung 990 Pro 2TB with Heatsink' → variant='Heatsink'. 'Seagate FireCuda 530 1TB Heatsink (PS5)' → variant='Heatsink'. The variant must be unique within a (manufacturer, series, capacity, form_factor, interface) group; if every drive collapses to the same value, leave it empty.",
          "type": ["string", "null"]
        },
        "releaseYear": {
          "description": "Year of release",
          "type": ["number", "null"]
        },
        "last_manually_spec_verified_at": {
          "type": ["string", "null"],
          "format": "date-time",
          "description": "ISO 8601 timestamp of when the part specs were last manually verified by a human"
        }
      },
      "required": ["name"]
    },
    "identifiers": {
      "type": "object",
      "properties": {
        "version": {
          "type": "integer",
          "exclusiveMinimum": 0,
          "maximum": 9007199254740991,
          "description": "Monotonically increasing identity snapshot version"
        },
        "identifiers": {
          "type": "array",
          "items": {
            "type": "object",
            "properties": {
              "type": {
                "type": "string",
                "enum": ["upc", "ean", "gtin", "mpn"]
              },
              "value": {
                "type": "string",
                "minLength": 1
              },
              "region": {
                "default": "all",
                "type": "string",
                "minLength": 1
              }
            },
            "required": ["type", "value", "region"],
            "additionalProperties": false
          },
          "description": "Canonical product identifiers"
        },
        "retailer_listings": {
          "type": "array",
          "items": {
            "type": "object",
            "properties": {
              "source": {
                "type": "string",
                "minLength": 1
              },
              "channel": {
                "type": "string",
                "minLength": 1
              },
              "source_product_id": {
                "type": "string",
                "minLength": 1
              },
              "pricing_enabled": {
                "type": "boolean"
              },
              "excluded_source_offer_ids": {
                "type": "array",
                "items": {
                  "type": "string",
                  "minLength": 1,
                  "maxLength": 512
                }
              },
              "verified": {
                "type": "boolean"
              }
            },
            "required": ["source", "channel", "source_product_id", "pricing_enabled", "verified"],
            "additionalProperties": false
          },
          "description": "Canonical retailer product listings used for pricing"
        }
      },
      "required": ["version", "identifiers", "retailer_listings"],
      "additionalProperties": false,
      "description": "Current versioned product identity snapshot used for retailer and pricing matching"
    }
  }
}
