{
  "opendb_id": "814e7aa5-ca32-4af3-9537-9af26ce9d049",
  "capacity": 240,
  "storage_type": "SSD",
  "form_factor": "2.5\"",
  "interface": "SATA 6.0 Gb/s",
  "nvme": false,
  "lighting": [],
  "metadata": {
    "name": "Intenso High Performance 240GB SSD 2.5\" SATA 6.0 Gb/s",
    "manufacturer": "Intenso",
    "part_numbers": ["3813440"],
    "series": "High",
    "variant": "240GB"
  },
  "general_product_information": {},
  "identifiers": {
    "version": 1,
    "identifiers": [
      {
        "type": "mpn",
        "value": "3813440",
        "region": "all"
      }
    ],
    "retailer_listings": []
  }
}
