{
  "opendb_id": "eeb027b5-d527-44df-869b-32b8ea5be7bc",
  "capacity": 256,
  "storage_type": "SSD",
  "form_factor": "M.2-2280",
  "interface": "M.2 PCIe 3.0 x4",
  "nvme": true,
  "lighting": [],
  "metadata": {
    "name": "Apacer AS2280P4U 256GB M.2-2280 SSD PCIe 3.0 x4 NVMe",
    "manufacturer": "Apacer",
    "part_numbers": ["AP256GAS2280P4U-1"],
    "series": "AS2280P4U",
    "variant": "256GB"
  },
  "general_product_information": {},
  "identifiers": {
    "version": 1,
    "identifiers": [
      {
        "type": "mpn",
        "value": "AP256GAS2280P4U-1",
        "region": "all"
      }
    ],
    "retailer_listings": []
  }
}
