{
  "opendb_id": "a3523898-c5d4-47fa-aa0a-55cc4b45031e",
  "capacity": 1024,
  "storage_type": "SSD",
  "form_factor": "2.5\"",
  "interface": "SATA 6.0 Gb/s",
  "nvme": false,
  "lighting": [],
  "metadata": {
    "name": "Crucial MX500 1TB SSD 2.5\" SATA",
    "manufacturer": "Crucial",
    "part_numbers": ["CT1000MX500SSD1", "CT1000MX500SSD1Z"],
    "series": "MX500",
    "variant": "1000GB"
  },
  "general_product_information": {},
  "identifiers": {
    "version": 1,
    "identifiers": [
      {
        "type": "ean",
        "value": "0649528785107",
        "region": "all"
      },
      {
        "type": "mpn",
        "value": "CT1000MX500SSD1",
        "region": "all"
      },
      {
        "type": "mpn",
        "value": "CT1000MX500SSD1T",
        "region": "all"
      },
      {
        "type": "mpn",
        "value": "CT1000MX500SSD1Z",
        "region": "all"
      },
      {
        "type": "upc",
        "value": "649528785107",
        "region": "all"
      }
    ],
    "retailer_listings": [
      {
        "source": "amazon",
        "channel": "au",
        "source_product_id": "B077SF8KMG",
        "pricing_enabled": true,
        "verified": true
      },
      {
        "source": "amazon",
        "channel": "be",
        "source_product_id": "B077SF8KMG",
        "pricing_enabled": true,
        "verified": true
      },
      {
        "source": "amazon",
        "channel": "ca",
        "source_product_id": "B077SF8KMG",
        "pricing_enabled": true,
        "verified": true
      },
      {
        "source": "amazon",
        "channel": "de",
        "source_product_id": "B077SF8KMG",
        "pricing_enabled": true,
        "verified": true
      },
      {
        "source": "amazon",
        "channel": "es",
        "source_product_id": "B077SF8KMG",
        "pricing_enabled": true,
        "verified": true
      },
      {
        "source": "amazon",
        "channel": "fr",
        "source_product_id": "B077SF8KMG",
        "pricing_enabled": true,
        "verified": true
      },
      {
        "source": "amazon",
        "channel": "ie",
        "source_product_id": "B077SF8KMG",
        "pricing_enabled": true,
        "verified": true
      },
      {
        "source": "amazon",
        "channel": "it",
        "source_product_id": "B077SF8KMG",
        "pricing_enabled": true,
        "verified": true
      },
      {
        "source": "amazon",
        "channel": "jp",
        "source_product_id": "B077SF8KMG",
        "pricing_enabled": true,
        "verified": true
      },
      {
        "source": "amazon",
        "channel": "nl",
        "source_product_id": "B077SF8KMG",
        "pricing_enabled": true,
        "verified": true
      },
      {
        "source": "amazon",
        "channel": "pl",
        "source_product_id": "B077SF8KMG",
        "pricing_enabled": true,
        "verified": true
      },
      {
        "source": "amazon",
        "channel": "se",
        "source_product_id": "B077SF8KMG",
        "pricing_enabled": true,
        "verified": true
      },
      {
        "source": "amazon",
        "channel": "sg",
        "source_product_id": "B077SF8KMG",
        "pricing_enabled": true,
        "verified": true
      },
      {
        "source": "amazon",
        "channel": "uk",
        "source_product_id": "B077SF8KMG",
        "pricing_enabled": true,
        "verified": true
      },
      {
        "source": "amazon",
        "channel": "us",
        "source_product_id": "B077SF8KMG",
        "pricing_enabled": true,
        "verified": true
      },
      {
        "source": "cenowarka",
        "channel": "pl",
        "source_product_id": "1819918",
        "pricing_enabled": true,
        "verified": false
      },
      {
        "source": "geizhals",
        "channel": "de",
        "source_product_id": "1819918",
        "pricing_enabled": true,
        "verified": false
      },
      {
        "source": "gigantec",
        "channel": "es",
        "source_product_id": "23618",
        "pricing_enabled": true,
        "verified": false
      },
      {
        "source": "newegg",
        "channel": "ca",
        "source_product_id": "9SIA12KJEC3194",
        "pricing_enabled": true,
        "verified": false
      },
      {
        "source": "newegg",
        "channel": "us",
        "source_product_id": "9SIA12KJEC3194",
        "pricing_enabled": true,
        "verified": false
      },
      {
        "source": "quzo",
        "channel": "uk",
        "source_product_id": "73212",
        "pricing_enabled": true,
        "verified": false
      },
      {
        "source": "skinflint",
        "channel": "uk",
        "source_product_id": "1819918",
        "pricing_enabled": true,
        "verified": false
      }
    ]
  }
}
