{
  "opendb_id": "a0aea000-8d42-41bd-aec0-f32cc3ac1dd9",
  "capacity": 1000,
  "storage_type": "SSD",
  "form_factor": "M.2-2280",
  "interface": "M.2 PCIe 4.0 x4",
  "nvme": true,
  "lighting": [],
  "metadata": {
    "name": "Corsair MP600 PRO LPX 1TB M.2 SSD PCIe 4.0 NVMe",
    "manufacturer": "Corsair",
    "part_numbers": ["CSSD-F1000GBMP600PLPW"],
    "series": "MP600",
    "variant": "1000GB"
  },
  "general_product_information": {},
  "identifiers": {
    "version": 1,
    "identifiers": [
      {
        "type": "ean",
        "value": "0840006692119",
        "region": "all"
      },
      {
        "type": "mpn",
        "value": "CSSD-F1000GBMP600PLPW",
        "region": "all"
      },
      {
        "type": "upc",
        "value": "840006692119",
        "region": "all"
      }
    ],
    "retailer_listings": [
      {
        "source": "alternate",
        "channel": "de",
        "source_product_id": "1903562",
        "pricing_enabled": true,
        "verified": false
      },
      {
        "source": "alternate",
        "channel": "es",
        "source_product_id": "1903562",
        "pricing_enabled": true,
        "verified": false
      },
      {
        "source": "alternate",
        "channel": "fr",
        "source_product_id": "1903562",
        "pricing_enabled": true,
        "verified": false
      },
      {
        "source": "alternate",
        "channel": "it",
        "source_product_id": "1903562",
        "pricing_enabled": true,
        "verified": false
      },
      {
        "source": "amazon",
        "channel": "au",
        "source_product_id": "B0BWYX6BQ3",
        "pricing_enabled": true,
        "verified": true
      },
      {
        "source": "amazon",
        "channel": "be",
        "source_product_id": "B0BWYX6BQ3",
        "pricing_enabled": true,
        "verified": true
      },
      {
        "source": "amazon",
        "channel": "ca",
        "source_product_id": "B0BWYX6BQ3",
        "pricing_enabled": true,
        "verified": true
      },
      {
        "source": "amazon",
        "channel": "de",
        "source_product_id": "B0BWYX6BQ3",
        "pricing_enabled": true,
        "verified": true
      },
      {
        "source": "amazon",
        "channel": "es",
        "source_product_id": "B0BWYX6BQ3",
        "pricing_enabled": true,
        "verified": true
      },
      {
        "source": "amazon",
        "channel": "fr",
        "source_product_id": "B0BWYX6BQ3",
        "pricing_enabled": true,
        "verified": true
      },
      {
        "source": "amazon",
        "channel": "ie",
        "source_product_id": "B0BWYX6BQ3",
        "pricing_enabled": true,
        "verified": true
      },
      {
        "source": "amazon",
        "channel": "it",
        "source_product_id": "B0BWYX6BQ3",
        "pricing_enabled": true,
        "verified": true
      },
      {
        "source": "amazon",
        "channel": "jp",
        "source_product_id": "B0BWYX6BQ3",
        "pricing_enabled": true,
        "verified": true
      },
      {
        "source": "amazon",
        "channel": "nl",
        "source_product_id": "B0BWYX6BQ3",
        "pricing_enabled": true,
        "verified": true
      },
      {
        "source": "amazon",
        "channel": "pl",
        "source_product_id": "B0BWYX6BQ3",
        "pricing_enabled": true,
        "verified": true
      },
      {
        "source": "amazon",
        "channel": "se",
        "source_product_id": "B0BWYX6BQ3",
        "pricing_enabled": true,
        "verified": true
      },
      {
        "source": "amazon",
        "channel": "sg",
        "source_product_id": "B0BWYX6BQ3",
        "pricing_enabled": true,
        "verified": true
      },
      {
        "source": "amazon",
        "channel": "uk",
        "source_product_id": "B0BWYX6BQ3",
        "pricing_enabled": true,
        "verified": true
      },
      {
        "source": "amazon",
        "channel": "us",
        "source_product_id": "B0BWYX6BQ3",
        "pricing_enabled": true,
        "verified": true
      },
      {
        "source": "bhphoto",
        "channel": "us",
        "source_product_id": "COMP600PL1TW",
        "pricing_enabled": true,
        "verified": false
      },
      {
        "source": "caseking",
        "channel": "de",
        "source_product_id": "SSCS-092",
        "pricing_enabled": true,
        "verified": false
      },
      {
        "source": "cenowarka",
        "channel": "pl",
        "source_product_id": "2917749",
        "pricing_enabled": true,
        "verified": false
      },
      {
        "source": "corsair",
        "channel": "ca",
        "source_product_id": "CSSD-F1000GBMP600PLPW",
        "pricing_enabled": true,
        "verified": false
      },
      {
        "source": "corsair",
        "channel": "de",
        "source_product_id": "CSSD-F1000GBMP600PLPW",
        "pricing_enabled": true,
        "verified": false
      },
      {
        "source": "corsair",
        "channel": "es",
        "source_product_id": "CSSD-F1000GBMP600PLPW",
        "pricing_enabled": true,
        "verified": false
      },
      {
        "source": "corsair",
        "channel": "fr",
        "source_product_id": "CSSD-F1000GBMP600PLPW",
        "pricing_enabled": true,
        "verified": false
      },
      {
        "source": "corsair",
        "channel": "it",
        "source_product_id": "CSSD-F1000GBMP600PLPW",
        "pricing_enabled": true,
        "verified": false
      },
      {
        "source": "corsair",
        "channel": "uk",
        "source_product_id": "CSSD-F1000GBMP600PLPW",
        "pricing_enabled": true,
        "verified": false
      },
      {
        "source": "corsair",
        "channel": "us",
        "source_product_id": "CSSD-F1000GBMP600PLPW",
        "pricing_enabled": true,
        "verified": false
      },
      {
        "source": "geizhals",
        "channel": "de",
        "source_product_id": "2917749",
        "pricing_enabled": true,
        "verified": false
      },
      {
        "source": "jimms-pc",
        "channel": "fi",
        "source_product_id": "190614",
        "pricing_enabled": true,
        "verified": false
      },
      {
        "source": "newegg",
        "channel": "ca",
        "source_product_id": "N82E16820236977",
        "pricing_enabled": true,
        "verified": false
      },
      {
        "source": "newegg",
        "channel": "us",
        "source_product_id": "N82E16820236977",
        "pricing_enabled": true,
        "verified": false
      },
      {
        "source": "ruedecommerce",
        "channel": "fr",
        "source_product_id": "AR202402010114",
        "pricing_enabled": true,
        "verified": false
      },
      {
        "source": "skinflint",
        "channel": "uk",
        "source_product_id": "2917749",
        "pricing_enabled": true,
        "verified": false
      },
      {
        "source": "walmart",
        "channel": "us",
        "source_product_id": "2518734923",
        "pricing_enabled": true,
        "verified": false
      }
    ]
  }
}
